<?xml version="1.0" encoding="UTF-8"?>
<book xmlns="http://www.mingrisoft.com" xmlns:xsi="http://www.w3.org/2001/XMLSchema-instance"
	xsi:schemaLocation="http://www.mingrisoft.com attributeGroup_demo.xsd">

	<name>《C#從入門到精通(第2版)》</name>
	<publisher>清華大學出版社</publisher>
	<company>明日科技</company>
	<author msn="wangxiaoke@mingrisoft.com" qq="200958602" tel="0431-84978981">王小科
	</author>
	<ISBN>9787302226628</ISBN>
	<price>2.0</price>
	<url>http://www.mingribook.com/bookinfo.php?id=227</url>
</book>
